{
  "schemaVersion": "4.0.0",
  "recordType": "squad_fit",
  "recordId": "squad-example",
  "createdAt": "2026-07-24T00:00:00Z",
  "status": "BLOCKED",
  "provenance": {},
  "canonicalPlayerId": null,
  "targetClubId": null,
  "depthChartSnapshot": {},
  "roleNeedScore": null,
  "marginalImpactScore": null,
  "partnerSynergies": [],
  "roleConflicts": [],
  "availabilityImpact": {}
}
